{
  "$id": "https://kurultai.local/buildroom/schemas/implementation-receipt.schema.json",
  "$schema": "https://json-schema.org/draft/2020-12/schema",
  "additionalProperties": false,
  "properties": {
    "assignee": {
      "type": "string"
    },
    "blocked_items": {
      "items": {
        "type": "string"
      },
      "type": "array"
    },
    "build_id": {
      "type": "string"
    },
    "commands_run": {
      "items": {
        "type": "string"
      },
      "type": "array"
    },
    "commit_sha": {
      "type": "string"
    },
    "completed_at": {
      "type": "string"
    },
    "deviations_from_plan": {
      "items": {
        "type": "string"
      },
      "type": "array"
    },
    "evidence_refs": {
      "items": {
        "type": "string"
      },
      "type": "array"
    },
    "files_changed": {
      "items": {
        "type": "string"
      },
      "type": "array"
    },
    "kanban_status": {
      "type": "string"
    },
    "kanban_task_id": {
      "type": "string"
    },
    "open_diffs_summary": {
      "type": "string"
    },
    "receipt_id": {
      "type": "string"
    },
    "started_at": {
      "type": "string"
    },
    "tests_run": {
      "items": {
        "type": "string"
      },
      "type": "array"
    }
  },
  "required": [
    "receipt_id",
    "build_id",
    "assignee",
    "started_at",
    "completed_at",
    "files_changed",
    "commands_run",
    "tests_run",
    "commit_sha",
    "open_diffs_summary",
    "deviations_from_plan",
    "blocked_items",
    "kanban_task_id",
    "kanban_status",
    "evidence_refs"
  ],
  "title": "implementation-receipt",
  "type": "object"
}
