{
  "assignee": "temujin",
  "blocked_items": [],
  "build_id": "build-buildroom-foundation-demo",
  "commands_run": [
    "python3 tools/kurultai/buildroom/scripts/validate_room.py tools/kurultai/buildroom/rooms/demo-room"
  ],
  "commit_sha": "",
  "completed_at": "2026-05-10T20:10:00Z",
  "deviations_from_plan": [],
  "evidence_refs": [
    "kanban:t_demo_buildroom",
    "brain:receipt/demo"
  ],
  "files_changed": [
    "tools/kurultai/buildroom/README.md"
  ],
  "kanban_status": "done",
  "kanban_task_id": "t_demo_buildroom",
  "open_diffs_summary": "Demo adapter validation only.",
  "receipt_id": "receipt-t_demo_buildroom",
  "started_at": "2026-05-10T20:00:00Z",
  "tests_run": [
    "buildroom validation passed"
  ]
}
